{
  "recipe_id": "consolidation-v1.1",
  "source": "nucleus-research consolidation line @ b3c58e1 (provenance only). v1.1 FORKS v1.0 on exactly one knob: replay.source amp -> rawlog. Everything else -- amplification dose, deny-then-correct fraction, LoRA rank/alpha, LR, epochs, replay frac 0.30, neg_boost 0 -- is byte-identical to v1.0, so this fork changes WHERE past material is drawn from and nothing about how it is trained.",
  "note": "WHY v1.1 EXISTS (D18 + founders, 2026-07-27). rawlog is the LOCKED ARCHITECTURE: D18 made the reservoir audit/provenance and put replay on prior DAY-LOGS re-read via C10, so C14 serves a ledger and deliberately not corpus bodies. v1.0 pinned `amp` for one reason only -- the Phase-1 goldens were produced that way, so pinning it let us diff our numbers against theirs. That was a measurement scaffold, not a training preference, and v1.0's own note named the flip as pending the day-log fetch client: 'Flipping source to rawlog is a validated tie but needs the day-log fetch client and forks recipe_id to v1.1.' That client landed with the storage/continuum handover, so the stated precondition is met. WHAT IT UNBLOCKS: under `amp` only a user's FIRST night could run over HTTP -- night 2 asks the reservoir for corpus bodies that C14 does not serve by design. The live seam_check proved exactly that. WHY IT IS SAFE: raw-vs-amp was MEASURED A TIE (Gnandeep, 2026-07-22), and tests/parity/ runs its own harness against its own goldens rather than this recipe, so the research-parity proof is untouched by the flip. WHY NOW: forking recipe_id invalidates cached amplify/train stages and relabels C5 lineage -- both cost ZERO at this instant, because the founders' wipe (D19) leaves no prior lineage to fork away from and no cache to invalidate. It will never be this cheap again. v1.0 IS RETAINED, not deleted: it is the recipe the Phase-1/Phase-3 numbers were produced under, and deleting it would orphan their provenance.",
  "amplify": {
    "variants": 48,
    "neg_frac": 0.15,
    "ok_rate_min": 0.85
  },
  "replay": {
    "frac": 0.3,
    "source": "rawlog",
    "neg_boost": 0.0
  },
  "train": {
    "lora_r": 128,
    "lora_alpha": 256,
    "lr": 0.0001,
    "epochs": 3,
    "batch_size": 2,
    "chunk_tokens": 1024,
    "objective": "next-token CPT (never QA-SFT)"
  },
  "corpus": {
    "quality_min": 0.5,
    "block_segments": 12,
    "segment_seconds": 10
  },
  "window": {
    "boundary_local_time": "04:00"
  }
}
