{
  "recipe_id": "consolidation-v1.0",
  "source": "nucleus-research consolidation line @ b3c58e1 (provenance only). Knobs confirmed against the Phase-1 goldens: replay frac 0.30, source amp, neg_boost 0. Flipping source to rawlog is a validated tie but needs the day-log fetch client and forks recipe_id to v1.1.",
  "note": "Provenance/commit re-pin only \u2014 no TRAINING knob changed, so recipe_id stands and artifacts trained under it remain comparable. Gate/publish thresholds moved OUT to policies/gate-policy-v1.1.json (ratified 2026-07-24): they are publish policy, and recipe_id enters the amplify/train stage keys.",
  "amplify": {
    "variants": 48,
    "neg_frac": 0.15,
    "ok_rate_min": 0.85
  },
  "replay": {
    "frac": 0.3,
    "source": "amp",
    "neg_boost": 0.0
  },
  "train": {
    "lora_r": 128,
    "lora_alpha": 256,
    "lr": 0.0001,
    "epochs": 3,
    "batch_size": 2,
    "chunk_tokens": 1024,
    "objective": "next-token CPT (never QA-SFT)"
  },
  "corpus": {
    "quality_min": 0.5,
    "block_segments": 12,
    "segment_seconds": 10
  },
  "window": {
    "boundary_local_time": "04:00"
  }
}
